<?xml version="1.0" encoding="UTF-8"?>
<!DOCTYPE hta SYSTEM "huppaal-0.6.dtd">
<hta>
	<template type="XOR">
		<name>Template</name>
		<entry id="Template.ENTRY">
			<name>ENTRY</name>
			<connection>
				<target ref="Template.A.7" />
			</connection>
		</entry>
		<exit id="Template.EXIT13">
			<name>EXIT</name>
		</exit>
		<location id="Template.A.7">
			<name>A</name>
			<label kind="invariant" />
		</location>
		<location id="Template.B.12">
			<name>B</name>
			<label kind="invariant" />
		</location>
		<component id="Template.8" instantiates="SD">
			<name>N9</name>
		</component>
		<transition>
			<source exitref="SD.EXIT11" ref="Template.8" />
			<target ref="Template.B.12" />
		</transition>
		<transition>
			<source ref="Template.A.7" />
			<target entryref="SD.ENTRY" ref="Template.8" />
			<label kind="guard" />
			<label kind="assignment" />
			<label kind="synchronisation" />
		</transition>
	</template>
	<template type="XOR">
		<name>SD</name>
		<entry id="SD.ENTRY">
			<name>ENTRY</name>
			<connection>
				<target ref="SD.S.10" />
			</connection>
		</entry>
		<exit id="SD.EXIT11">
			<name>EXIT</name>
			<connection>
				<source ref="SD.S.10" />
			</connection>
		</exit>
		<location id="SD.S.10">
			<name>S</name>
			<label kind="invariant" />
		</location>
	</template>
	<instantiation>template := Template();</instantiation>
	<system>system template;</system>
	<globalinit ref="Template.ENTRY" instantiationname="template" />
</hta>